{
  "$schema": "http://json-schema.org/draft-07/schema#",
  "$id": "TplfaRequest",
  "title": "TplfaRequest",
  "$ref": "#/definitions/TplfaRequest",
  "definitions": {
    "TplfaRequest": {
      "type": "object",
      "required": ["url", "body", "method"],
      "properties": {
        "url": { "type": "string" },
        "method": { "type": "string" },
        "body": { "type": "object" },
        "headers": {
          "type": "object",
          "additionalProperties": {
            "type": "string"
          }
        },
        "browsingTopics": { "type": "boolean"},
        "keepalive": {"type": "boolean"}
      },
      "additionalProperties": {
        "type": "string"
      }
    }
  }
}
